{
  "persona_id": "night-owl-dreamer",
  "display_name": "Night Owl Dreamer",
  "vibe_summary": "When others wind down, you're just getting started. Late-night productivity, creative spurts, or simply enjoying the peaceful solitude of nighttimeâ€”you thrive when the sun goes down. You need strains that help you eventually transition to restful sleep without knocking you out too early in your nocturnal adventures.",
  "tag_profile": {
    "primary_tags": ["relaxing", "sedating", "sleepy", "calming"],
    "secondary_tags": ["cozy", "pain-relief", "body-relaxation"],
    "avoid_tags": ["energizing", "racy", "stimulating", "anxiety-inducing"]
  },
  "image_style_keywords": [
    "deep night sky",
    "soft purple and indigo",
    "dreamy starlight",
    "peaceful darkness",
    "lunar energy",
    "restful night vibes"
  ]
}
