{
  "persona_id": "mystical-wanderer",
  "display_name": "Mystical Wanderer",
  "vibe_summary": "You're drawn to the spiritual, the mysterious, and the profound. Whether exploring consciousness, practicing spiritual rituals, or seeking deeper meaning, you appreciate strains that facilitate introspection and connection to something greater. Your experiences are about expansion, insight, and transcendence.",
  "tag_profile": {
    "primary_tags": ["introspective", "cerebral", "psychedelic", "spiritual"],
    "secondary_tags": ["creative", "euphoric", "sensory-enhancing"],
    "avoid_tags": ["anxious", "paranoid", "couch-lock", "foggy"]
  },
  "image_style_keywords": [
    "mystical purple and gold",
    "cosmic atmosphere",
    "spiritual symbols",
    "ethereal light",
    "transcendent energy",
    "sacred geometry"
  ]
}
