{
  "persona_id": "weekend-warrior",
  "display_name": "Weekend Warrior",
  "vibe_summary": "You save your sessions for special occasions and weekends. When you do partake, you want it to countâ€”maximum enjoyment, memorable experiences, and fun adventures. You prefer strains that create distinctive, enjoyable experiences worthy of your intentional consumption. Quality over quantity is your motto.",
  "tag_profile": {
    "primary_tags": ["euphoric", "fun", "social", "memorable"],
    "secondary_tags": ["uplifting", "creative", "adventurous"],
    "avoid_tags": ["subtle", "mild", "underwhelming"]
  },
  "image_style_keywords": [
    "celebration atmosphere",
    "festive energy",
    "vibrant weekend vibes",
    "joyful moments",
    "special occasion glow",
    "memorable experiences"
  ]
}
