{
  "persona_id": "balanced-harmonizer",
  "display_name": "Balanced Harmonizer",
  "vibe_summary": "You seek the middle pathâ€”not too energizing, not too sedating, just right. You appreciate versatility and want strains that work for various situations throughout your day. Whether it's gentle motivation in the morning or mild relaxation in the evening, you value balanced effects that enhance without overwhelming.",
  "tag_profile": {
    "primary_tags": ["balanced", "versatile", "moderate", "hybrid"],
    "secondary_tags": ["mood-enhancing", "relaxing", "uplifting"],
    "avoid_tags": ["extreme", "intense", "overwhelming", "one-dimensional"]
  },
  "image_style_keywords": [
    "harmonious blend of colors",
    "balanced composition",
    "gentle transitions",
    "peaceful equilibrium",
    "moderate lighting",
    "versatile ambiance"
  ]
}
